organisationen_literaturId,organisationsId,literatur
1,1,"Gerhard WINNER, Art. Aggsbach, Dorf (BH Melk), in: Donauländer und Burgenland, hg. von Karl LECHNER (Handbuch der Historischen Stätten = Kröners Taschenausgabe 278, Stuttgart 21985) 184f."
2,5,"Gerhard A. STADLER, Das industrielle Erbe Niederösterreichs. Geschichte – Technik – Architektur (Wien–Köln–Weimar 2006)."
3,13,"Konrad JEKL, Stadtgemeinde Hardegg, in: Vergangenheit und Gegenwart. Der Bezirk Hollabrunn und seine Gemeinden, hg. von Ernst BEZEMEK–Willibald ROSNER (Hollabrunn 1993) 637–651, hier 644f."
4,27,http://www.maissau.at/Schloss_Unterduernbach_2
5,33,Burgen-Austria.com: http://www.burgen-austria.com/archive.php?id=961
6,79,"Friedrich Wilhelm WEISKERN, Topographie von Niederösterreich [...], Bd. 1 (Wien 1778) 92-94."
